{
  "schema_version": 1,
  "week": 1,
  "seed": 20261015,
  "jobs": [
    {
      "id": "w01-1",
      "level": "motor_trial",
      "cargo": "mail",
      "axis": "efficient",
      "rep": 1,
      "blurb": "把 mail（镇民邮件）送过motor_trial。电要省着花，镇发电站的老王只认能耗账。"
    },
    {
      "id": "w01-2",
      "level": "signal_echo",
      "cargo": "medkit",
      "axis": "safe",
      "rep": 2,
      "blurb": "把 medkit（医疗包）送过signal_echo。货怕晃，净空就是一切，慢就是快。"
    },
    {
      "id": "w01-3",
      "level": "signal_cross",
      "cargo": "grain",
      "axis": "fast",
      "rep": 4,
      "blurb": "把 grain（种子粮）送过signal_cross。镇上等着用，越快越好——但别撞，撞了这单 reputation 照扣。"
    },
    {
      "id": "w01-4",
      "level": "localization",
      "cargo": "parts",
      "axis": "efficient",
      "rep": 1,
      "blurb": "把 parts（机器零件）送过localization。电要省着花，镇发电站的老王只认能耗账。"
    },
    {
      "id": "w01-5",
      "level": "big_freight",
      "cargo": "water",
      "axis": "safe",
      "rep": 5,
      "blurb": "把 water（净水）送过big_freight。货怕晃，净空就是一切，慢就是快。"
    }
  ]
}
